[
  {
    "role_id": "procurement",
    "role_name": "procurement",
    "authority": ["suspend_vendor_contract", "request_attestation", "escalate_to_legal"],
    "liability": ["procurement_compliance", "vendor_risk_management"],
    "expertise_level": "mixed",
    "admissible_actions": ["suspend_vendor_contract", "request_attestation", "escalate_to_legal", "require_remediation"],
    "acceptable_abstraction_levels": ["mixed", "nontechnical"],
    "evidence_needs": ["metric", "value", "severity", "regulatory_mapping", "limitations"],
    "weights": {
      "material_relevance": 0.2,
      "epistemic_warrant": 0.15,
      "normative_alignment": 0.25,
      "interpretive_fit": 0.15,
      "decision_actionability": 0.15,
      "limitation_propagation": 0.05,
      "audit_traceability": 0.05
    }
  },
  {
    "role_id": "vendor",
    "role_name": "vendor",
    "authority": ["provide_attestation", "request_clarification"],
    "liability": ["attestation_accuracy", "contractual_compliance"],
    "expertise_level": "mixed",
    "admissible_actions": ["provide_attestation", "request_clarification"],
    "acceptable_abstraction_levels": ["mixed", "technical"],
    "evidence_needs": ["metric", "value", "method", "limitations"],
    "weights": {
      "material_relevance": 0.3,
      "epistemic_warrant": 0.2,
      "normative_alignment": 0.1,
      "interpretive_fit": 0.15,
      "decision_actionability": 0.15,
      "limitation_propagation": 0.05,
      "audit_traceability": 0.05
    }
  },
  {
    "role_id": "executive",
    "role_name": "executive",
    "authority": ["approve_deployment", "halt_programme", "allocate_remediation_budget"],
    "liability": ["organisational_risk", "regulatory_exposure"],
    "expertise_level": "executive",
    "admissible_actions": ["approve_deployment", "halt_programme", "require_board_briefing", "escalate"],
    "acceptable_abstraction_levels": ["nontechnical", "mixed"],
    "evidence_needs": ["severity", "regulatory_mapping", "context_tags"],
    "weights": {
      "material_relevance": 0.15,
      "epistemic_warrant": 0.1,
      "normative_alignment": 0.2,
      "interpretive_fit": 0.2,
      "decision_actionability": 0.2,
      "limitation_propagation": 0.1,
      "audit_traceability": 0.05
    }
  }
]
